{
  "schemaVersion": 1,
  "name": "review-walkthrough",
  "fixture": "sessions/review-walkthrough",
  "turns": [
    {"developer": "Review the requirements for 00001-csv-export.", "expects": "\\?\\s*$"},
    {"developer": "1", "expects": "\\?\\s*$"},
    {"developer": "No edit. I dispute it: this is deliberate, and I accept what it costs.", "expects": "\\?\\s*$"},
    {"developer": "Take your recommendation.", "expects": "\\?\\s*$"},
    {"developer": "Stop here. Give me the recap and the approval summary."}
  ]
}
