{
  "schemaVersion": 1,
  "name": "resume-after-intake",
  "continues": "intake-all-supplied",
  "turns": [
    {
      "developer": "Continue spec 00001-invoice-pdf.",
      "edit": {
        "path": ".kiro/specs/00001-invoice-pdf/.config.kiro",
        "text": "{\"specId\": \"0d1e2f3a-4b5c-4d6e-8f7a-9b0c1d2e3f4a\", \"workflowType\": \"design-first\", \"specType\": \"feature\"}\n"
      }
    },
    {
      "developer": "Leave both files as they are; tell me what you found."
    }
  ]
}
