{
  "schemaVersion": 1,
  "name": "tasks-planning",
  "fixture": "sessions/tasks-planning",
  "turns": [
    {
      "developer": "Continue spec 00002-order-export."
    },
    {
      "developer": "Approve the tasks."
    },
    {
      "developer": "I accept the guess 'at most 10,000 orders per file' by name, for the tasks too."
    },
    {
      "developer": "Approve the tasks."
    }
  ]
}
